{
 "event_id": "ac501628-16d0-49a9-83c3-52d7887d7b11",
 "event_name": "governance.content_read",
 "event_category": "GOVERNANCE",
 "occurred_at": "2026-10-18T10:00:00Z",
 "ingested_at": "2026-10-18T10:00:01Z",
 "actor_type": "SYSTEM_SERVICE",
 "actor_id": "svc_platform",
 "actor_role_code": "system_service",
 "resource_type": "event",
 "resource_id": "479ae3ae-7848-41a2-bf66-aa731ffc1e59",
 "payload": {
  "content_read_id": "5ba6cebe-7b1c-5b88-8ac5-8d417e696dcf"
 },
 "schema_version": "1.3.0",
 "dictionary_version": "1.3",
 "integrity_status": "ok",
 "integrity_hash": "bbbbbbbbbbbbbbbbbbbbbbbbbbbbbbbbbbbbbbbbbbbbbbbbbbbbbbbbbbbbbbbb",
 "event_idempotency_key": "key_9eb13388d0b4454ca43a19706a948a14",
 "event_processing_state": "accepted",
 "record_property": "synthetic_test",
 "event_sequence_no": 0
}