{
 "event_id": "18b91555-5387-422a-bbdf-92541d097caa",
 "event_name": "account.email_verified",
 "event_category": "PARTICIPANT",
 "occurred_at": "2026-10-18T10:00:00Z",
 "ingested_at": "2026-10-18T10:00:01Z",
 "actor_type": "SYSTEM_SERVICE",
 "actor_id": "svc_platform",
 "actor_role_code": "system_service",
 "resource_type": "account",
 "resource_id": "dfea4ab9-1d5e-4bc1-9cc5-eb558c921f2e",
 "payload": {
  "account_id": "5ba6cebe-7b1c-5b88-8ac5-8d417e696dcf",
  "email_verified_at": "2026-10-18T10:00:00Z"
 },
 "schema_version": "1.3.0",
 "dictionary_version": "1.3",
 "integrity_status": "ok",
 "integrity_hash": "bbbbbbbbbbbbbbbbbbbbbbbbbbbbbbbbbbbbbbbbbbbbbbbbbbbbbbbbbbbbbbbb",
 "event_idempotency_key": "key_bfe095d84bd84746a880c464b764613b",
 "event_processing_state": "accepted",
 "record_property": "synthetic_test",
 "event_sequence_no": 0
}