{
 "event_id": "e76b77f1-5da8-47c8-b4dc-ccc4db166a80",
 "event_name": "release.recipient_created",
 "event_category": "REPORT",
 "occurred_at": "2026-10-18T10:00:00Z",
 "ingested_at": "2026-10-18T10:00:01Z",
 "actor_type": "SYSTEM_SERVICE",
 "actor_id": "svc_platform",
 "actor_role_code": "system_service",
 "resource_type": "report",
 "resource_id": "09b406a4-c22c-4be0-a2a6-f56c1c6bca73",
 "payload": {
  "recipient_release_id": "5ba6cebe-7b1c-5b88-8ac5-8d417e696dcf",
  "recipient_address_hash": "aaaaaaaaaaaaaaaaaaaaaaaaaaaaaaaaaaaaaaaaaaaaaaaaaaaaaaaaaaaaaaaa",
  "token_state": "active"
 },
 "schema_version": "1.3.0",
 "dictionary_version": "1.3",
 "integrity_status": "ok",
 "integrity_hash": "bbbbbbbbbbbbbbbbbbbbbbbbbbbbbbbbbbbbbbbbbbbbbbbbbbbbbbbbbbbbbbbb",
 "event_idempotency_key": "key_972977c8976c4115b65bfa3f916b0bf1",
 "event_processing_state": "accepted",
 "record_property": "synthetic_test",
 "event_sequence_no": 0
}