{
 "event_id": "2df1d040-30a1-4aba-ae1a-415d5f721722",
 "event_name": "correction.changed",
 "event_category": "REPORT",
 "occurred_at": "2026-10-18T10:00:00Z",
 "ingested_at": "2026-10-18T10:00:01Z",
 "actor_type": "SYSTEM_SERVICE",
 "actor_id": "svc_platform",
 "actor_role_code": "system_service",
 "resource_type": "report",
 "resource_id": "4988f646-6074-4688-a339-6a571039e34c",
 "payload": {
  "correction_request_id": "5ba6cebe-7b1c-5b88-8ac5-8d417e696dcf"
 },
 "schema_version": "1.3.0",
 "dictionary_version": "1.3",
 "integrity_status": "ok",
 "integrity_hash": "bbbbbbbbbbbbbbbbbbbbbbbbbbbbbbbbbbbbbbbbbbbbbbbbbbbbbbbbbbbbbbbb",
 "event_idempotency_key": "key_c353309a4e40462faefa921f918a9cd6",
 "event_processing_state": "accepted",
 "record_property": "synthetic_test",
 "event_sequence_no": 0
}