{
 "event_id": "2266e1f0-8ae5-4477-be29-d5ac37cb766a",
 "event_name": "governance.recusal_recorded",
 "event_category": "GOVERNANCE",
 "occurred_at": "2026-10-18T10:00:00Z",
 "ingested_at": "2026-10-18T10:00:01Z",
 "actor_type": "SYSTEM_SERVICE",
 "actor_id": "svc_platform",
 "actor_role_code": "system_service",
 "resource_type": "event",
 "resource_id": "5273695a-c70f-4f5f-8e1e-dd6be7f1429d",
 "payload": {
  "recusal_id": "5ba6cebe-7b1c-5b88-8ac5-8d417e696dcf"
 },
 "schema_version": "1.3.0",
 "dictionary_version": "1.3",
 "integrity_status": "ok",
 "integrity_hash": "bbbbbbbbbbbbbbbbbbbbbbbbbbbbbbbbbbbbbbbbbbbbbbbbbbbbbbbbbbbbbbbb",
 "event_idempotency_key": "key_9a82e6791c7248e098c399a094eb92f2",
 "event_processing_state": "accepted",
 "record_property": "synthetic_test",
 "event_sequence_no": 0
}