{
 "event_id": "748b078b-5cc0-4adc-8592-c332ecf5b55a",
 "event_name": "observation.session_started",
 "event_category": "OBSERVATION",
 "occurred_at": "2026-10-18T10:00:00Z",
 "ingested_at": "2026-10-18T10:00:01Z",
 "actor_type": "SYSTEM_SERVICE",
 "actor_id": "svc_platform",
 "actor_role_code": "system_service",
 "resource_type": "observation",
 "resource_id": "388de189-6eee-4a51-975e-2ca99b6cc19f",
 "payload": {
  "session_id": "5ba6cebe-7b1c-5b88-8ac5-8d417e696dcf",
  "stage_instance_id": "5ba6cebe-7b1c-5b88-8ac5-8d417e696dcf",
  "session_started_at": "2026-10-18T10:00:00Z"
 },
 "schema_version": "1.3.0",
 "dictionary_version": "1.3",
 "integrity_status": "ok",
 "integrity_hash": "bbbbbbbbbbbbbbbbbbbbbbbbbbbbbbbbbbbbbbbbbbbbbbbbbbbbbbbbbbbbbbbb",
 "event_idempotency_key": "key_0136147b02894a4a8786491c14815482",
 "event_processing_state": "accepted",
 "record_property": "synthetic_test",
 "event_sequence_no": 0
}