{
 "event_id": "8d5f0851-dbd5-4eed-a798-c5e22d305dd2",
 "event_name": "consent.lsa_changed",
 "event_category": "CONSENT",
 "occurred_at": "2026-10-18T10:00:00Z",
 "ingested_at": "2026-10-18T10:00:01Z",
 "actor_type": "SYSTEM_SERVICE",
 "actor_id": "svc_platform",
 "actor_role_code": "system_service",
 "resource_type": "consent",
 "resource_id": "e0002faa-a068-44f5-af0e-7d3c99f2e207",
 "payload": {
  "lsa_consent_state": "never_asked"
 },
 "schema_version": "1.3.0",
 "dictionary_version": "1.3",
 "integrity_status": "ok",
 "integrity_hash": "bbbbbbbbbbbbbbbbbbbbbbbbbbbbbbbbbbbbbbbbbbbbbbbbbbbbbbbbbbbbbbbb",
 "event_idempotency_key": "key_3893d4a6b8c94a20a4f9a9b91d04bcc5",
 "event_processing_state": "accepted",
 "record_property": "synthetic_test",
 "event_sequence_no": 0
}