{
 "event_id": "5bbbaff2-fa45-4ee9-8f8f-f61879f662da",
 "event_name": "employer.application_submitted",
 "event_category": "EMPLOYER",
 "occurred_at": "2026-10-18T10:00:00Z",
 "ingested_at": "2026-10-18T10:00:01Z",
 "actor_type": "SYSTEM_SERVICE",
 "actor_id": "svc_platform",
 "actor_role_code": "system_service",
 "resource_type": "employer_organization",
 "resource_id": "d28395af-d9e6-42d4-8a4f-1585599e1ed8",
 "payload": {
  "business_registry_id": "5ba6cebe-7b1c-5b88-8ac5-8d417e696dcf"
 },
 "schema_version": "1.3.0",
 "dictionary_version": "1.3",
 "integrity_status": "ok",
 "integrity_hash": "bbbbbbbbbbbbbbbbbbbbbbbbbbbbbbbbbbbbbbbbbbbbbbbbbbbbbbbbbbbbbbbb",
 "event_idempotency_key": "key_5cedbd0011c14228bd039585ad77093c",
 "event_processing_state": "accepted",
 "record_property": "synthetic_test",
 "event_sequence_no": 0
}