{
 "event_id": "4ba3f03e-3f90-43ae-ba04-f0be43f1068b",
 "event_name": "retention.run_completed",
 "event_category": "GOVERNANCE",
 "occurred_at": "2026-10-18T10:00:00Z",
 "ingested_at": "2026-10-18T10:00:01Z",
 "actor_type": "SYSTEM_SERVICE",
 "actor_id": "svc_platform",
 "actor_role_code": "system_service",
 "resource_type": "event",
 "resource_id": "f6ffe6bb-14b8-4e2a-8af9-ddff7328c4a3",
 "payload": {
  "destruction_run_id": "5ba6cebe-7b1c-5b88-8ac5-8d417e696dcf",
  "anonymization_run_id": "5ba6cebe-7b1c-5b88-8ac5-8d417e696dcf"
 },
 "schema_version": "1.3.0",
 "dictionary_version": "1.3",
 "integrity_status": "ok",
 "integrity_hash": "bbbbbbbbbbbbbbbbbbbbbbbbbbbbbbbbbbbbbbbbbbbbbbbbbbbbbbbbbbbbbbbb",
 "event_idempotency_key": "key_5082a48e206946b9b38d3c07779c7b14",
 "event_processing_state": "accepted",
 "record_property": "synthetic_test",
 "event_sequence_no": 0
}