{
 "event_id": "779ec075-542f-44e8-bf6e-6defb289935d",
 "event_name": "consent.lsa_changed",
 "event_category": "CONSENT",
 "occurred_at": "2026-10-18T10:00:00Z",
 "ingested_at": "2026-10-18T10:00:01Z",
 "actor_type": "SYSTEM_SERVICE",
 "actor_id": "svc_platform",
 "actor_role_code": "system_service",
 "resource_type": "consent",
 "resource_id": "6f011f58-d566-4971-b09c-652c071b3139",
 "payload": {
  "lsa_consent_state": "never_asked",
  "lsa_consent_text_version": "1.0.0",
  "lsa_consent_timestamp": "2026-10-18T10:00:00Z",
  "lsa_withdrawal_timestamp": "2026-10-18T10:00:00Z"
 },
 "schema_version": "1.3.0",
 "dictionary_version": "1.3",
 "integrity_status": "ok",
 "integrity_hash": "bbbbbbbbbbbbbbbbbbbbbbbbbbbbbbbbbbbbbbbbbbbbbbbbbbbbbbbbbbbbbbbb",
 "event_idempotency_key": "key_7a82b1891e8149faacdd5e0cacc9b35d",
 "event_processing_state": "accepted",
 "record_property": "synthetic_test",
 "event_sequence_no": 0
}