{
 "event_id": "52ab717b-21b2-454f-bcc6-61b46b55277b",
 "event_name": "growthlog.entry_changed",
 "event_category": "PARTICIPANT",
 "occurred_at": "2026-10-18T10:00:00Z",
 "ingested_at": "2026-10-18T10:00:01Z",
 "actor_type": "SYSTEM_SERVICE",
 "actor_id": "svc_platform",
 "actor_role_code": "system_service",
 "resource_type": "account",
 "resource_id": "0baa460a-5b2e-4705-9990-73c8efa70a51",
 "payload": {
  "created_at": "2026-10-18T10:00:00Z",
  "updated_at": "2026-10-18T10:00:00Z",
  "schema_version": "1.0.0"
 },
 "schema_version": "1.3.0",
 "dictionary_version": "1.3",
 "integrity_status": "ok",
 "integrity_hash": "bbbbbbbbbbbbbbbbbbbbbbbbbbbbbbbbbbbbbbbbbbbbbbbbbbbbbbbbbbbbbbbb",
 "event_idempotency_key": "key_eef8d17a470d44128e269b4d3fd9bf3e",
 "event_processing_state": "accepted",
 "record_property": "synthetic_test",
 "event_sequence_no": 0
}