{
 "event_id": "551849aa-a416-43e5-92f2-883de8b34a5d",
 "event_name": "mentor.calibration_recorded",
 "event_category": "MENTOR",
 "occurred_at": "2026-10-18T10:00:00Z",
 "ingested_at": "2026-10-18T10:00:01Z",
 "actor_type": "SYSTEM_SERVICE",
 "actor_id": "svc_platform",
 "actor_role_code": "system_service",
 "resource_type": "mentor",
 "resource_id": "3ada7701-7106-4b04-98f9-87ad1be61597",
 "payload": {
  "calibration_record_id": "5ba6cebe-7b1c-5b88-8ac5-8d417e696dcf"
 },
 "schema_version": "1.3.0",
 "dictionary_version": "1.3",
 "integrity_status": "ok",
 "integrity_hash": "bbbbbbbbbbbbbbbbbbbbbbbbbbbbbbbbbbbbbbbbbbbbbbbbbbbbbbbbbbbbbbbb",
 "event_idempotency_key": "key_d5f797b5793a4bbf966afe6a5cf2dcbd",
 "event_processing_state": "accepted",
 "record_property": "synthetic_test",
 "event_sequence_no": 0
}