{
 "event_id": "607915e6-e8e5-461d-967c-771b163fcb98",
 "event_name": "observation.corrected",
 "event_category": "OBSERVATION",
 "occurred_at": "2026-10-18T10:00:00Z",
 "ingested_at": "2026-10-18T10:00:01Z",
 "actor_type": "SYSTEM_SERVICE",
 "actor_id": "svc_platform",
 "actor_role_code": "system_service",
 "resource_type": "observation",
 "resource_id": "978b5a4f-f3af-4284-8ff3-d9773489083e",
 "payload": {
  "supersedes": "5ba6cebe-7b1c-5b88-8ac5-8d417e696dcf",
  "superseded_by": "5ba6cebe-7b1c-5b88-8ac5-8d417e696dcf"
 },
 "schema_version": "1.3.0",
 "dictionary_version": "1.3",
 "integrity_status": "ok",
 "integrity_hash": "bbbbbbbbbbbbbbbbbbbbbbbbbbbbbbbbbbbbbbbbbbbbbbbbbbbbbbbbbbbbbbbb",
 "event_idempotency_key": "key_684c30afd13f45978216e9ea6382d91b",
 "event_processing_state": "accepted",
 "record_property": "synthetic_test",
 "event_sequence_no": 0
}