{
 "event_id": "5307576b-35b5-42f9-bfbd-e80c92957849",
 "event_name": "participant.profile_updated",
 "event_category": "PARTICIPANT",
 "occurred_at": "2026-10-18T10:00:00Z",
 "ingested_at": "2026-10-18T10:00:01Z",
 "actor_type": "SYSTEM_SERVICE",
 "actor_id": "svc_platform",
 "actor_role_code": "system_service",
 "resource_type": "account",
 "resource_id": "d434881b-9bb1-4048-8bb7-007f696adc6a",
 "payload": {
  "occupational_classification_version": "1.0.0",
  "country_of_residence": "C1",
  "subdivision_of_residence": "C1",
  "privacy_jurisdiction_code": "C1",
  "preferred_language": "C1",
  "timezone": "C1",
  "profile_field_source": "stated_by_participant",
  "notification_channel_preference": "email",
  "target_industry_code": "C1",
  "role_seniority_context_code": "entry",
  "recruitment_channel_code": "search"
 },
 "schema_version": "1.3.0",
 "dictionary_version": "1.3",
 "integrity_status": "ok",
 "integrity_hash": "bbbbbbbbbbbbbbbbbbbbbbbbbbbbbbbbbbbbbbbbbbbbbbbbbbbbbbbbbbbbbbbb",
 "event_idempotency_key": "key_6286a61dffd84fa9ba35579a15bb554a",
 "event_processing_state": "accepted",
 "record_property": "synthetic_test",
 "event_sequence_no": 0
}