{
 "event_id": "d38e7f62-f682-4a4b-9235-344699255756",
 "event_name": "observation.determination_recorded",
 "event_category": "OBSERVATION",
 "occurred_at": "2026-10-18T10:00:00Z",
 "ingested_at": "2026-10-18T10:00:01Z",
 "actor_type": "SYSTEM_SERVICE",
 "actor_id": "svc_platform",
 "actor_role_code": "system_service",
 "resource_type": "observation",
 "resource_id": "f049f1ca-8c8e-4fe7-8ca8-f10d31cbe2fc",
 "payload": {
  "determination_id": "5ba6cebe-7b1c-5b88-8ac5-8d417e696dcf",
  "question_id": "5ba6cebe-7b1c-5b88-8ac5-8d417e696dcf",
  "answer_option_id": "5ba6cebe-7b1c-5b88-8ac5-8d417e696dcf",
  "determined_by": "5ba6cebe-7b1c-5b88-8ac5-8d417e696dcf",
  "determined_at": "2026-10-18T10:00:00Z",
  "question_serving_state": "direct",
  "branch_trigger_ref": "5ba6cebe-7b1c-5b88-8ac5-8d417e696dcf"
 },
 "schema_version": "1.3.0",
 "dictionary_version": "1.3",
 "integrity_status": "ok",
 "integrity_hash": "bbbbbbbbbbbbbbbbbbbbbbbbbbbbbbbbbbbbbbbbbbbbbbbbbbbbbbbbbbbbbbbb",
 "event_idempotency_key": "key_a0539a2db2d545959984deca4c30dd59",
 "event_processing_state": "accepted",
 "record_property": "synthetic_test",
 "event_sequence_no": 0
}