{
 "event_id": "cc7b5d88-e3da-4a28-99a6-b1355540f229",
 "event_name": "report.review_completed",
 "event_category": "REPORT",
 "occurred_at": "2026-10-18T10:00:00Z",
 "ingested_at": "2026-10-18T10:00:01Z",
 "actor_type": "SYSTEM_SERVICE",
 "actor_id": "svc_platform",
 "actor_role_code": "system_service",
 "resource_type": "report",
 "resource_id": "95c5ffc2-4308-48c3-a2de-993638e2fc25",
 "payload": {
  "reviewer_independence_state": "independent",
  "evidence_review_id": "5ba6cebe-7b1c-5b88-8ac5-8d417e696dcf",
  "reviewer_id": "5ba6cebe-7b1c-5b88-8ac5-8d417e696dcf",
  "review_completed_at": "2026-10-18T10:00:00Z",
  "version_set_hash": "aaaaaaaaaaaaaaaaaaaaaaaaaaaaaaaaaaaaaaaaaaaaaaaaaaaaaaaaaaaaaaaa"
 },
 "schema_version": "1.3.0",
 "dictionary_version": "1.3",
 "integrity_status": "ok",
 "integrity_hash": "bbbbbbbbbbbbbbbbbbbbbbbbbbbbbbbbbbbbbbbbbbbbbbbbbbbbbbbbbbbbbbbb",
 "event_idempotency_key": "key_9dab4cf278f34fca8b551098aace7a21",
 "event_processing_state": "accepted",
 "record_property": "synthetic_test",
 "event_sequence_no": 0
}