{
 "event_id": "f63fe9be-49b6-434f-bddf-be551db1cdac",
 "event_name": "program.created",
 "event_category": "PROGRAM",
 "occurred_at": "2026-10-18T10:00:00Z",
 "ingested_at": "2026-10-18T10:00:01Z",
 "actor_type": "SYSTEM_SERVICE",
 "actor_id": "svc_platform",
 "actor_role_code": "system_service",
 "resource_type": "program",
 "resource_id": "38624b8d-a3c8-436b-9702-eb4bcfacaeb0",
 "payload": {
  "organization_program_id": "5ba6cebe-7b1c-5b88-8ac5-8d417e696dcf",
  "program_version": "1.0.0",
  "operating_jurisdiction_code": "C1",
  "jurisdiction_rule_version": "1.0.0"
 },
 "schema_version": "1.3.0",
 "dictionary_version": "1.3",
 "integrity_status": "ok",
 "integrity_hash": "bbbbbbbbbbbbbbbbbbbbbbbbbbbbbbbbbbbbbbbbbbbbbbbbbbbbbbbbbbbbbbbb",
 "event_idempotency_key": "key_3d66504495824f0fab29077dc1671612",
 "event_processing_state": "accepted",
 "record_property": "synthetic_test",
 "event_sequence_no": 0
}