{
 "event_id": "f8db61b6-265f-4c1a-8672-c1e2a998fba4",
 "event_name": "system.deployment_verified",
 "event_category": "SYSTEM",
 "occurred_at": "2026-10-18T10:00:00Z",
 "ingested_at": "2026-10-18T10:00:01Z",
 "actor_type": "SYSTEM_SERVICE",
 "actor_id": "svc_platform",
 "actor_role_code": "system_service",
 "resource_type": "configuration",
 "resource_id": "010611ce-74e5-4fcc-8ddb-c9b14121280b",
 "payload": {
  "hosting_region": "ca",
  "backup_region": "ca"
 },
 "schema_version": "1.3.0",
 "dictionary_version": "1.3",
 "integrity_status": "ok",
 "integrity_hash": "bbbbbbbbbbbbbbbbbbbbbbbbbbbbbbbbbbbbbbbbbbbbbbbbbbbbbbbbbbbbbbbb",
 "event_idempotency_key": "key_6f786c4337664755bcac940550e1ff85",
 "event_processing_state": "accepted",
 "record_property": "synthetic_test",
 "event_sequence_no": 0
}