{
 "event_id": "ffe87ba3-44a3-47a3-9cf3-ed582474513b",
 "event_name": "governance.control_operated",
 "event_category": "GOVERNANCE",
 "occurred_at": "2026-10-18T10:00:00Z",
 "ingested_at": "2026-10-18T10:00:01Z",
 "actor_type": "SYSTEM_SERVICE",
 "actor_id": "svc_platform",
 "actor_role_code": "system_service",
 "resource_type": "event",
 "resource_id": "a686ddbe-8465-484d-af66-2a8ac6552dd2",
 "payload": {
  "control_run_id": "5ba6cebe-7b1c-5b88-8ac5-8d417e696dcf"
 },
 "schema_version": "1.3.0",
 "dictionary_version": "1.3",
 "integrity_status": "ok",
 "integrity_hash": "bbbbbbbbbbbbbbbbbbbbbbbbbbbbbbbbbbbbbbbbbbbbbbbbbbbbbbbbbbbbbbbb",
 "event_idempotency_key": "key_dfb38850beb6497cb5e37afddcb108ef",
 "event_processing_state": "accepted",
 "record_property": "synthetic_test",
 "event_sequence_no": 0
}