{
 "event_id": "e3de96d0-d05e-4639-b687-f5829f46da23",
 "event_name": "observation.session_abandoned",
 "event_category": "OBSERVATION",
 "occurred_at": "2026-10-18T10:00:00Z",
 "ingested_at": "2026-10-18T10:00:01Z",
 "actor_type": "SYSTEM_SERVICE",
 "actor_id": "svc_platform",
 "actor_role_code": "system_service",
 "resource_type": "observation",
 "resource_id": "73d28992-0aac-45b7-acf4-7200f979337c",
 "payload": {
  "abandonment_state": "none"
 },
 "schema_version": "1.3.0",
 "dictionary_version": "1.3",
 "integrity_status": "ok",
 "integrity_hash": "bbbbbbbbbbbbbbbbbbbbbbbbbbbbbbbbbbbbbbbbbbbbbbbbbbbbbbbbbbbbbbbb",
 "event_idempotency_key": "key_449aa8e1c9424a7098bdb8c44b43f089",
 "event_processing_state": "accepted",
 "record_property": "synthetic_test",
 "event_sequence_no": 0
}