{
 "event_id": "a6ee906b-bea3-4f26-b334-e27bb991c09a",
 "event_name": "mentor.engagement_recorded",
 "event_category": "MENTOR",
 "occurred_at": "2026-10-18T10:00:00Z",
 "ingested_at": "2026-10-18T10:00:01Z",
 "actor_type": "SYSTEM_SERVICE",
 "actor_id": "svc_platform",
 "actor_role_code": "system_service",
 "resource_type": "mentor",
 "resource_id": "b512aa36-876a-4eea-9c6a-a090af3aa464",
 "payload": {
  "observations_per_month_commitment": 1
 },
 "schema_version": "1.3.0",
 "dictionary_version": "1.3",
 "integrity_status": "ok",
 "integrity_hash": "bbbbbbbbbbbbbbbbbbbbbbbbbbbbbbbbbbbbbbbbbbbbbbbbbbbbbbbbbbbbbbbb",
 "event_idempotency_key": "key_bca7ea44cbc843e08ea2a4e0e198d674",
 "event_processing_state": "accepted",
 "record_property": "synthetic_test",
 "event_sequence_no": 0
}