{
 "event_id": "749ccd32-c936-4beb-91d5-4d662c2d81cb",
 "event_name": "system.deployment_verified",
 "event_category": "SYSTEM",
 "occurred_at": "2026-10-18T10:00:00Z",
 "ingested_at": "2026-10-18T10:00:01Z",
 "actor_type": "SYSTEM_SERVICE",
 "actor_id": "svc_platform",
 "actor_role_code": "system_service",
 "resource_type": "configuration",
 "resource_id": "dea8b658-33cd-49bb-ba0b-dac4fbfccadf",
 "payload": {
  "hosting_region": "ca",
  "backup_region": "ca"
 },
 "schema_version": "1.3.0",
 "dictionary_version": "1.3",
 "integrity_status": "ok",
 "integrity_hash": "bbbbbbbbbbbbbbbbbbbbbbbbbbbbbbbbbbbbbbbbbbbbbbbbbbbbbbbbbbbbbbbb",
 "event_idempotency_key": "key_2565b8344a474a2495b46da62ecdbbd3",
 "event_processing_state": "accepted",
 "record_property": "synthetic_test",
 "event_sequence_no": 0
}